{
  "schemaVersion": 1,
  "evidenceKind": "m0_interception_budget",
  "definitionVersion": "phase2-m0-v1",
  "definitionDigest": "sha256:9aa8410b9f773ef130e45dee801d1fe34707e8f6df9bdf120a79bba9b757f374",
  "generatedAt": "2026-08-27T14:09:55.295Z",
  "commit": "f6ef8a6999c487b5ff1984b50f07846240893317",
  "gitDirty": true,
  "environment": {
    "timestamp": "2026-08-27T13:23:58.577Z",
    "commit": "f6ef8a6999c487b5ff1984b50f07846240893317",
    "dirty": true,
    "os": "win32",
    "osRelease": "10.0.26200",
    "architecture": "x64",
    "cpu": "13th Gen Intel(R) Core(TM) i5-13420H",
    "memoryBytes": 16813264896,
    "nodeVersion": "v24.15.0",
    "pnpmVersion": "unavailable",
    "workloadDefinitionDigest": "sha256:9aa8410b9f773ef130e45dee801d1fe34707e8f6df9bdf120a79bba9b757f374"
  },
  "workloads": [
    {
      "workloadId": "large",
      "fileCount": 50000,
      "budgetMs": 5000,
      "coldInitializationMs": 15426.947333333332,
      "coldInitializationRunsMs": [
        14980.4053,
        15540.7267,
        15759.71
      ],
      "runs": [
        {
          "runId": "run-1",
          "warmupSamples": [
            {
              "baselineNs": 8783500,
              "instrumentedNs": 3853761200,
              "overheadNs": 3844977700,
              "failure": null
            },
            {
              "baselineNs": 11594200,
              "instrumentedNs": 481908200,
              "overheadNs": 470314000,
              "failure": null
            },
            {
              "baselineNs": 9750000,
              "instrumentedNs": 502593100,
              "overheadNs": 492843100,
              "failure": null
            },
            {
              "baselineNs": 9899100,
              "instrumentedNs": 485296400,
              "overheadNs": 475397300,
              "failure": null
            },
            {
              "baselineNs": 10128100,
              "instrumentedNs": 384063800,
              "overheadNs": 373935700,
              "failure": null
            }
          ],
          "samples": [
            {
              "baselineNs": 8712900,
              "instrumentedNs": 502050600,
              "overheadNs": 493337700,
              "failure": null
            },
            {
              "baselineNs": 12877100,
              "instrumentedNs": 472148200,
              "overheadNs": 459271100,
              "failure": null
            },
            {
              "baselineNs": 3999500,
              "instrumentedNs": 374980100,
              "overheadNs": 370980600,
              "failure": null
            },
            {
              "baselineNs": 7938600,
              "instrumentedNs": 372610100,
              "overheadNs": 364671500,
              "failure": null
            },
            {
              "baselineNs": 10159800,
              "instrumentedNs": 407244400,
              "overheadNs": 397084600,
              "failure": null
            },
            {
              "baselineNs": 2505200,
              "instrumentedNs": 417636000,
              "overheadNs": 415130800,
              "failure": null
            },
            {
              "baselineNs": 8890300,
              "instrumentedNs": 363888300,
              "overheadNs": 354998000,
              "failure": null
            },
            {
              "baselineNs": 6732700,
              "instrumentedNs": 433053800,
              "overheadNs": 426321100,
              "failure": null
            },
            {
              "baselineNs": 5811600,
              "instrumentedNs": 287034700,
              "overheadNs": 281223100,
              "failure": null
            },
            {
              "baselineNs": 12002400,
              "instrumentedNs": 452768400,
              "overheadNs": 440766000,
              "failure": null
            },
            {
              "baselineNs": 11395600,
              "instrumentedNs": 390106800,
              "overheadNs": 378711200,
              "failure": null
            },
            {
              "baselineNs": 10400000,
              "instrumentedNs": 405126300,
              "overheadNs": 394726300,
              "failure": null
            },
            {
              "baselineNs": 9473400,
              "instrumentedNs": 437074000,
              "overheadNs": 427600600,
              "failure": null
            },
            {
              "baselineNs": 9446700,
              "instrumentedNs": 194501500,
              "overheadNs": 185054800,
              "failure": null
            },
            {
              "baselineNs": 8316700,
              "instrumentedNs": 433967900,
              "overheadNs": 425651200,
              "failure": null
            },
            {
              "baselineNs": 10176200,
              "instrumentedNs": 457559300,
              "overheadNs": 447383100,
              "failure": null
            },
            {
              "baselineNs": 9390900,
              "instrumentedNs": 436613700,
              "overheadNs": 427222800,
              "failure": null
            },
            {
              "baselineNs": 5639400,
              "instrumentedNs": 445944000,
              "overheadNs": 440304600,
              "failure": null
            },
            {
              "baselineNs": 10026400,
              "instrumentedNs": 416813800,
              "overheadNs": 406787400,
              "failure": null
            },
            {
              "baselineNs": 9015800,
              "instrumentedNs": 475216900,
              "overheadNs": 466201100,
              "failure": null
            },
            {
              "baselineNs": 4967100,
              "instrumentedNs": 362332700,
              "overheadNs": 357365600,
              "failure": null
            },
            {
              "baselineNs": 9210700,
              "instrumentedNs": 310695700,
              "overheadNs": 301485000,
              "failure": null
            },
            {
              "baselineNs": 9323800,
              "instrumentedNs": 429913900,
              "overheadNs": 420590100,
              "failure": null
            },
            {
              "baselineNs": 6129600,
              "instrumentedNs": 486740800,
              "overheadNs": 480611200,
              "failure": null
            },
            {
              "baselineNs": 9329100,
              "instrumentedNs": 491802800,
              "overheadNs": 482473700,
              "failure": null
            },
            {
              "baselineNs": 7334200,
              "instrumentedNs": 286560500,
              "overheadNs": 279226300,
              "failure": null
            },
            {
              "baselineNs": 9520400,
              "instrumentedNs": 427097600,
              "overheadNs": 417577200,
              "failure": null
            },
            {
              "baselineNs": 5858900,
              "instrumentedNs": 454418300,
              "overheadNs": 448559400,
              "failure": null
            },
            {
              "baselineNs": 10056700,
              "instrumentedNs": 560967100,
              "overheadNs": 550910400,
              "failure": null
            },
            {
              "baselineNs": 9901500,
              "instrumentedNs": 577984400,
              "overheadNs": 568082900,
              "failure": null
            }
          ],
          "p50Ms": 420.5901,
          "p95Ms": 550.9104
        },
        {
          "runId": "run-2",
          "warmupSamples": [
            {
              "baselineNs": 13282900,
              "instrumentedNs": 274302800,
              "overheadNs": 261019900,
              "failure": null
            },
            {
              "baselineNs": 8086600,
              "instrumentedNs": 441630100,
              "overheadNs": 433543500,
              "failure": null
            },
            {
              "baselineNs": 7983600,
              "instrumentedNs": 452737000,
              "overheadNs": 444753400,
              "failure": null
            },
            {
              "baselineNs": 7390700,
              "instrumentedNs": 453730900,
              "overheadNs": 446340200,
              "failure": null
            },
            {
              "baselineNs": 11063500,
              "instrumentedNs": 449120700,
              "overheadNs": 438057200,
              "failure": null
            }
          ],
          "samples": [
            {
              "baselineNs": 11971400,
              "instrumentedNs": 389097800,
              "overheadNs": 377126400,
              "failure": null
            },
            {
              "baselineNs": 10647300,
              "instrumentedNs": 467461700,
              "overheadNs": 456814400,
              "failure": null
            },
            {
              "baselineNs": 9804000,
              "instrumentedNs": 477201100,
              "overheadNs": 467397100,
              "failure": null
            },
            {
              "baselineNs": 8835400,
              "instrumentedNs": 376867500,
              "overheadNs": 368032100,
              "failure": null
            },
            {
              "baselineNs": 10371300,
              "instrumentedNs": 471283900,
              "overheadNs": 460912600,
              "failure": null
            },
            {
              "baselineNs": 5199700,
              "instrumentedNs": 486653800,
              "overheadNs": 481454100,
              "failure": null
            },
            {
              "baselineNs": 5797700,
              "instrumentedNs": 299938300,
              "overheadNs": 294140600,
              "failure": null
            },
            {
              "baselineNs": 9563000,
              "instrumentedNs": 460384400,
              "overheadNs": 450821400,
              "failure": null
            },
            {
              "baselineNs": 10742100,